{
  "profile_version": "0.9.0",
  "profile_id": "official-hosted-v0.9.0",
  "benchmark_version": "0.9.0-precalibration",
  "scaffold_version": "0.9.0",
  "hosted_evaluation": true,
  "allowed_runner_types": ["baseline", "script"],
  "policy_bundle": {
    "system_prompt_policy_version": "system-policy-v0.9.0",
    "tool_policy_version": "tool-policy-v0.9.0",
    "context_policy_version": "context-policy-v0.9.0",
    "retry_policy_version": "retry-policy-v0.9.0",
    "timeout_policy_version": "timeout-policy-v0.9.0"
  },
  "evaluation_defaults": {
    "repeated_runs_min": 5,
    "timeout_seconds": 900,
    "max_turns_default": 8,
    "seed_policy": {
      "strategy": "fixed_declared",
      "require_declared_seeds": true
    }
  },
  "notes": "Frozen hosted evaluation profile for official-window-v0.9.0-precalibration-2026-03-15-to-2026-04-12."
}
